Link,Title,Content
https://www.herald.co.zw/chevrons-get-consolation-t20i-win/,Chevrons get consolation T20I win,"Zimpapers Sports Hub ZIMBABWE’S over-reliance on the batting of captain Sikandar Raza was cruelly exposed in the just ended five-match T20 International series against hosts, Bangladesh. An eight-wicket win with nine balls to spare in the final game yesterday ensured that Zimbabwe put something on the board and avoided a humiliating series whitewash. Zimbabwe’s consolation victory coincided with the first match Raza scored runs. The Chevrons’ T20I skipper flopped in the opening four matches and Zimbabwe found themselves starring a series whitewash going into yesterday’s match. All four defeats were a result of Zimbabwe batsmen, especially Raza and the top order, failing to score runs. When Raza got it right, Zimbabwe lost just two wickets chasing 158. After winning the toss, Raza sent Bangladesh to bat and the hosts made 157/6 off their 20 overs with a topscore of 54 from Mohammad Mahmudullah while Bennett claimed two wickets for 20 in three overs and Blessing Muzarabani taking two for 22 in four overs. Mahmudullah took to the crease with Bangladesh struggling at 15 for 3 and he used the opportunity to push for a solid role in Bangladesh’s team for the ICC T20 World Cup. Mahmudullah shared a 69-run fourth wicket stand with captain Najmul Hossain Shanto, who made 36. In reply, Zimbabwe lost Tadiwanashe Marumani for one in the fifth over. Raza was unbeaten on 72 runs off 46 balls when victory was achieved while opener Brian Bennett was named player-of-the-match for 70 runs in 49 balls with the bat and the two wickets for 20 with the  ball. Raza and Bennett featured in a 75-run partnership for the second wicket while the skipper and Jonathan Campbell were unbeaten on 45 in a third wicket stand when victory was achieved. Bennett believes yesterday’s victory should be a good foundation for the future as a number of young players join the Chevrons. “Very grateful for today. We came close in the last game but I am really happy for the team to go back with a victory, obviously not what you want from the series but a good effort from the team today. We have been backed and supported by the coaching staff. We have few youngsters in the team so I think we still have some time so let’s see what happens in the future,” he said. Raza was relieved to have finally found a solution to the batting nightmare. “It’s nice to go home with a win. Like we said in the last three games we were working our way closer and closer to the victory margin. It’s nice to contribute. In the last presentation I came here and said the only jigsaw puzzle that’s missing is me scoring runs. “If I can contribute towards the succession of the team it will give me immense pleasure. And today is one of those days. It’s always nice to contribute towards the winning of the side. When we were losing on those little margins, I thought that was on me. But Alhamdulillah (Praise be to God). “A lot of positives, I lost the series 4-1 but I can say that a lot of positives and we have something to work on for the future of the T20I cricket for Zimbabwe. I am very proud of the squad and I am sure these young guns will take Zimbabwe forward.” "
https://www.herald.co.zw/hollick-crowned-fbc-zim-open-champ/,Hollick crowned FBC Zim Open champ,"Eddie Chikamhi Senior Sports Reporter GOLFER Michael Hollick kicked off his birthday week in style after he beat a strong field to lift the 2024 FBC Zimbabwe Open Golf championship for the first time at Royal Harare yesterday afternoon. Hollick, who turns 37 on Wednesday, needed to summon all his golf prowess yesterday to finish with a 20-under-par 268 after an epic final day against South African compatriot Darren Fichardt, who pushed him to the limit with his 18-under-par 270. Zimbabwe’s top professional Scott Vincent was in third place with a respectable 14-under after a feisty last two days on the greens. His brother Kieran Vincent also put up a commendable show, tied for fourth place with Swedish golfer Frederick From. Another Zimbabwean Ben Follett-Smith was sixth on 11-under while highly rated Zimbabwean golf prodigy Matthew Bramford, was the top amateur after finishing on 38th place with a course par score 288. But as has become the norm, it was the South African golfers who dominated the event. Hollick, who won his second Sunshine Tour title with the FBC Zimbabwe Open success, was excited to be on the winning podium, six years after he last participated in the Harare event. “It’s always amazing to be here. I haven’t been here since Covid-19, so coming back was nice and the golf course hasn’t changed in the last five years. “It’s always brilliant from the first time I played here in 2011. So I am very pleased,” he said. The 36-year-old had to hold off competition from compatriot Fichardt with six birdies for his final round 66. Hollick had a one-stroke lead going into the final round after he had followed up his first two rounds of 66 and 67 with an impressive 68 in the third round on Saturday, leaving him on 15-under-par. He had a bogey on the 11th hole but the script still went his way yesterday with a crucial birdie in the 17th as Fichardt was dented by two bogeys on the second and 11th holes, despite also carding six birdies on the final day. “It was great,” said Hollick. “I have been lucky enough to play a lot of tournament golf with Darren over the years and he is one hell of a player. So I knew he wasn’t going to give it to me today and I had to go out and win it. Fortunately, I had the goods and I produced it in the end. “And, the biggest thanks go to the fans here; to the crowd that was out, here thank you so much. You really make the most incredible environment for us to play. “I also want to thank Royal Harare Golf Club for hosting us. The golf course was absolutely amazing and I can’t thank you guys enough. “I also want to thanks Darren Fichardt, it was a hell of a battle today. We had a good go out there and well-played,” said Hollick. For the umpteenth time, the Zimbabwe Open Golf title evaded the locals who were left waiting for their breakthrough 24 years since Mark McNulty became the last Zimbabwean to win it in 2000. Scott Vincent reignited Zimbabwe’s hopes for the better part of yesterday but his five-under 67 was not enough to give the top two South Africans a jolt as he settled in third place. His brother Kieran had started the day as the best placed Zimbabwean on 11-under par but he failed to continue with the momentum from the previous day. Bogies on the eighth, 10th and 13th holes came at a huge cost for the younger Vincent. Scott Vincent said the course was tough and will try again next year to challenge for the Zimbabwe Open. “The Sunshine Tour is always strong,” he said. “They always play really tough and obviously it’s good to have them come here and play and it was fun to play JC Ritchie. He is a fantastic player, he played on the world stage. “So all in all it’s a strong field and it’s good to be here. I would love to come back and play every year. We have just to see the scheduling and how it all works out,” said Scott Vincent. Sunshine Tour tournament director Gary Todd was thrilled by the successful hosting of the R2.5 million FBC Holdings-sponsored event. “On behalf of the Sunshine Tour I can’t thank FBC Holdings enough, it was such a fantastic event. “It would be rude of me not to mention the Royal Harare Golf Club course staff who have preserved the facility this week in the most outstanding condition. “To the people of Harare, who have come out and supported us during this magical week, I can’t believe it has gone so quickly and we won’t see you for another year, it’s too long,” said Todd. "
https://www.herald.co.zw/zdf-stamp-authority-in-pnl/,ZDF stamp authority in PNL,"Tadious Manyepo Sports Reporter PREMIER Netball League descended on Masvingo for the first time on Saturday with ZDF again showing no signs of tiring as they consolidated their lead with two victories attained from masterclass performances. There were three bubbles in place with Harare District dominating in the capital, ZDF walking tall in Masvingo while Harare City showed class in Marondera. But it was ZDF who stole the show in Masvingo where hordes of fans made their way to witness top-tier netball spectacle in their town for the first time. Inspired by Gems Goal Shooter Sharon Bwanali, ZDF put newcomers St P&P to the cleaners in a 142-7 punishing scoreline. They had been stretched to their last gear by rivals Black Rhinos who they finally managed to beat 54-41 in the bubble’s tightest duel. Without former champions Platinum Queens and Ngezi Platinum who have reportedly disbanded as well as Greenfuel whose fate is still unknown, ZDF could be just on their way to winning the title though it’s still early days yet. Bwanali, who was mobbed by Masvingo fans who were used to seeing her on television said ZDF need to stay grounded. “We might be on top of the situation and on top of everyone but we need to be cautious and remain focused,” she said. “Last year we finished fourth and we need to change that. “We know there are so many teams like Harare District, Black Rhinos and, Stormers, Harare City, who are doing well and can challenge us at the top so we need to keep on working very hard.” In Marondera, Harare City beat Waterfalls 70-16 before they accounted for Zupco 55-33 in another exciting game while Stormers also came out unscathed when dismissing Waterfalls 62-29 and Marondera 62-28. Harare District were the toast of the capital beating High Fliers 45-32 while Mutare City dismissed 7Flames 49-37 in the same bubble. PNL spokesperson Innocent Ndiya said all the bubbles went on well and more fans are coming for the game. Results Marondera Bubble Stormers 62-29 Waterfalls Harare City 70-16 Waterfalls Stormers 62-28 Marondera Marondera 47-42 Waterfalls Zupco 37-17 Waterfalls Harare City 55-33 Zupco Harare Bubble Mutare City 40-43 High Fliers Harare District 49-36 Mutare City 7Flames 29-34 High Fliers Harare District 45-32 High Fliers Mutare City 49-37 7Flames Masvingo Bubble St P&P 8-68 City Angel Argisters 8-86 Beitbridge ZDF 54-41  Black Rhinos ZDF 142-7 St P&P City Angels 63-12 Argisters Beitbridge 78-21 St P&P City Angels 20-67  Black Rhinos St P&P 7-130 Black Rhinos "
https://www.herald.co.zw/fc-platinum-silence-bosso-on-homeground/,FC Platinum silence Bosso on homeground,"Nkosilathi Sibanda in BULAWAYO Highlanders . . . . . . . . . . . . . . . . . . . . . .   0 FC Platinum . . . . . . . . . . . . . . . . . . . . .  . . 2 HIGHLANDERS’ promising start to the Castle Lager Premiership was dented as they succumbed to a 2-0 loss against visiting FC Platinum at Barbourfields yesterday. Early goals by FC Platinum, that came in  a flash, inside 10 minutes was all that separated the teams. FC Platinum opened the scoring in two minutes of play through Juan Mutudza, who positioned himself well to finish off a coordinated passage of play. Highlanders’s defence was caught off guard and exposed their goalkeeper, Raphael Pitisi, who dived the wrong way and let in a beauty of a shot. In the opening five minutes, Highlanders tried to raid the platinum miners with fast-paced attcks but the visitors’ defence was alert, shutting out the efforts. FC Platinum had the first corner, just in 10 minutes of play, Mutudza curled it and Lawrence Mhlanga rose high and nodded the second goal. That is all FC Platinum needed to collect maximum points. Highlanders were not in their usual form and the trusted defensive line,  led by captain Peter Muduhwa, was porous. After the second goal, Bosso attempted to regain composure and Mvelo Khoza’s thunderbolt went wide. Godfrey Makaruse, who was drafted in to replace Archford Faira, was fouled on the left lank by Hagiazo Magaya. However, Mbeba skied the free-kick. Bosso’s first corner came in the 30th minute. Prince Ndlovu took the kick but found no takers at goal. Another corner kick came and Andrew Mbeba was trusted to pass it through, instead, the ball was blocked by Platinum’ Rainsome Pavari. For Highlanders, the absence of the ever creative Melikhaya Ncube, who was serving a one-match suspension, was felt. At the 37th minute, Bosso had the chance to reply but McKinnon Mushore’s shot hit the upright post, with the rebound landing on Prince Ndlovu’s boots but he shot wide. In the opening 15 minutes of the second half, Highlanders had opportunities to hit back but Lynoth Chikuhwa fluffed them, while FC Platinum could have netted their third goal through Hagiazo Magaya. In the end, Kaindu rued the absence of Melikhaya. “We were unsettled in the first 10 minutes that we conceded two goals and it is always difficult to come back, especially against a team like FC Platinum. I think Melikhaya’s absence could have affected us. “We didn’t convert chances that came our way. Our opponents scored utilised the chances they got. Even in the second half we looked a bit stronger but unfortunately we couldn’t get the goals in terms of converting the chances that we had created. FC Platinum coach, Norman Mapeza, was a happy man. He was honest enough to say he did not expect the victory, given Bosso’s legacy at Barbourfields and their record so far. “It was a good game of football. I said it before, it was all to do with controlling the game in the opening minutes and that’s exactly what we did. We had some good opportunities to increase the lead. Overall it was a good game,” said Mapeza. “I told the guys that in the first 15 minutes they were going to come at us. It worked well as we needed to defend with four players at the back and made sure there were no crosses coming in between. Well done to my boys, they did exactly what we did at training,” said Mapeza. Teams: Highlanders: R. Pitisi, D. Mhindirira (Chigonero 66 minutes) , L. Chikuhwa, M. Mushore, P. Ndlovu, G. Makaruse ( T. Dube 79 minutes), A. Mbeba, M. Mushore, P. Muduhwa, M. Khoza ( Chigumira 66 minutes) B. Ncube FC Platinum: D. Bizabani, B. Nzori, L. Mhanga, R. Pavari, S. Mhlanga (Manhire 83 minutes)   H. Magaya, B. Banda, J. Mutudza (Mangiza 83 minutes), D. Marowa, (Bhebhe 61  minutes) P. Mutimbanyoka, W. Muvirimi (T Ngwenya 61 minutes) "
https://www.herald.co.zw/telone-fans-demand-chikunis-head/,TelOne fans demand Chikuni’s head,"Innocent Muchochomi, in GWERU TelOne . . . . . . . . . . . . . . . . . . .  0 Chegutu Pirates . . . . . . . . . .  (1) 2 TELONE coach Tendai Chikuni had a difficult time leaving Bata Stadium yesterday as fans gathered around the exit demanding his resignation following the defeat to visiting newboys Chegutu Pirates in a Castle Lager Premiership match yesterday. Blessing Ngazima and Gift Mwinga scored the goals that broke the home team fans’ hearts. The Gweru Premiership returnees have not won a game in their last six outings and the fans feel the team has disappointed after garnering 11 points from as many games. After the game yesterday, the irate TelOne supporters assembled outside the dressing rooms and had to be dispersed by the police who calmed the situation. Chikuni blamed his team for the defeat, but the fans’ reaction was a clear indication that they were disappointed with his performance. On the other hand, Chegutu Pirates coach Emmanuel Day Gutu breathed a sigh of relief as his team scored a goal in each half. The Premiership newboys marched into Bata Stadium with the sole aim of proving themselves as a force to be reckoned with. They got an early goal from a free kick in the fifth minute after Reginald Ngazima was fouled just outside the box. Gift Mwinga stepped up and curled a brilliant shot that beat TelOne goalkeeper Matshazi Thabiso all systems out. TelOne piled on the pressure in search of an equaliser with their star man Blessing Sahondo leading the quest but their found the Pirates defence that was well marshalled by Reuben Machaya in an uncompromising mood. After the half-time break, visiting coach Gutu introduced Russel Chifura, Tinotenda Ditima and Tinashe Mavhudzi to add flair to his side. The trio gelled immaculately, supplying a neat pass to Cleopas Dube who complemented it with an impish low header to increase the tally midway through the second half. After the final whistle, an elated Gutu gave credit to his players for the tough away win. “I’m a relieved man. As you can see, we were sitting in a precarious position on the league table.” “The win is a real boost as we are travelling to face Bikita Minerals away next week.” Gutu expressed gratitude towards their loyal supporters who have been with the team in every match, regardless of their performance. "
https://www.herald.co.zw/nakambas-luton-concede-epl-demotion/,Nakamba’s Luton concede EPL demotion,"LONDON. — Injured Warriors captain, Marvelous Nakamba will resume action in the English Championship after his Luton Town lasted just one season in the English Premiership. Nakamba was ruled out for the rest of the season following injury in December and was not able to help the club survive relegation, which was virtually confirmed on Saturday. Luton Town boss Rob Edwards said the Premier League was “just a bit too much” for his side after a 3-1 loss away at West Ham United all but sealed his team’s relegation. Luton have struggled to find their feet in their first season in England’s top flight since 1992, having won just one in 16 in the league, and not registered an away league win in 2024. “We didn’t get relegated because of today, it was a culmination of the whole season. Today was the difficult day but we’ve been on an incredible journey. I’m just really disappointed that I’m the one responsible,” he told reporters. Edwards praised his side’s performance in the first half, where Luton went into the break 1-0 up thanks to a sixth-minute header from Belgian midfielder Albert Sambi Lokonga. “We showed some really good things to go 1-0 up . . . we showed at times we’ve got quality to get behind them and get into good areas,” he told reporters. West Ham’s quality proved too much for the Hatters in the second half, and a much-improved performance from the home side saw goals from James Ward-Prowse, Tomas Soucek and George Earthy dealt a hammer blow to Luton’s hopes of survival. “Credit to them, they’ve got some really good players and we came up short,” Edwards added. Luton were not officially relegated on Saturday after Nottingham Forest lost 3-2 to Chelsea, but it will take a final day miracle for them to survive. They host Fulham on the final day of the season needing to overcome a three point and 12 goal-difference deficit to 17th placed Forest, who visit already relegated Burnley. Luton have won the respect of rival teams and fans alike this season with their style of play and approach, having risen all the way from the Conference — England’s fifth tier — in the last 10 years to achieve a place in the Premier League for this season. West Ham fans applauded Luton’s players off the pitch at the end of the match, which Edwards said was “touching”. “At times I think we’ve shown that we can compete with loads of teams, with everybody, and the growth and the improvement, I take pride in that,” he said. “I’ve loved it, and it fuels the fire to get back in.” Luton have struggled to compete financially with other teams in the Premier League this year and have spent far less than any other club according to Transfermarket. “We got promoted with one of the smallest budgets… It was a huge gap, chasm, between us and the Premier League. That won’t necessarily be the case now, we can be one of the stronger teams.” With Sheffield United and Burnley already relegated, it would be the first time since the 1997-1998 season that all three promoted teams go straight back down. Edwards said they wanted to go out in style against Fulham on the final day. “We want to try and go out on a high and show the best us, we owe that to our supporters, ourselves, and the league.” —Reuters/Sports Reporter. "
https://www.herald.co.zw/manica-diamonds-storm-to-the-top/,Manica Diamonds storm to the top,"Ray Bande in Mutare Manica Diamonds  . . . . . . . . . . . . . . . (0) 1 Bikita Minerals . . . . . . . . . . . . . . . . . .   0 MANICA Diamonds eased to the summit of the Castle Lager Premiership table after winning their seventh match on the trot, this time a 1-0 win over Bikita Minerals at Sakubva Stadium yesterday. Impressive Micheal Tapera’s 66th minute strike, his fifth goal in as many matches, was all the diamond miners needed to dismiss their opponents in this pulsating encounter that had all the ingredients of a derby.  In fact, the consistent Manica Diamonds left winger has been the main man behind Manica Diamonds’ resurgence, with his second half introduction, together with Charles Teguru on the right, proving too hot to handle for most of their opponents.  The fast-paced encounter started with both teams showing exuberance by creating scoring opportunities. First off the blocks were the lithium miners in the second minute when exciting Chris Makambira was floored just outside the box. Right back, Blessing Kagudu made a mess of the resultant free kick as he directed his effort into the left side netting. The hosts also had a clear cut scoring chance two minutes later when a flat footed yet rightly positioned Panashe Mutasa got to the end of neat exchange of passes but blasted the ball way over the cross bar from close range. The Gem Boys, as Manica Diamonds are fondly referred to by their growing legion of fans, almost surged ahead five minutes after the breather when Micheal Tapera latched on to a loose ball off a rebound and his blistering shot hit the crossbar while an already beaten Bikita Minerals goalkeeper Victor Machopa remained motionless. Tapera was back to torment the visiting side two minutes later when he ghosted from the right to connect Charles Teguru’s cross, but his header missed the target by inches. However, Manica Diamonds finally broke the deadlock in the 64th minute when Fortune Binzi tapped the ball to an unmarked Tapera’s in the box and the later made no mistake as he blasted the ball home to give the hosts the lead. Manica Diamonds coach Tapera acknowledged that the pressure is mounting with each match they continue collecting maximum points. “We have been on a winning streak, and that makes each match more challenging given that every opponent that we now face ups the tempo. “Nonetheless, that is the nature of the game. It comes with pressure with each outing and we just have to compete. I believe so far so good, we have been competing well and we hope to continue collecting maximum points as we go,” said Tapera.  The Manica Diamonds gaffer praised his men for a decent performance. “I am happy with the way we have been defending in all these matches we have won. We have kept a clean sheet and that is commendable. “On the transition to attack, we have also been impressive and that explains the rhythm in our play. It is flowing very well and we will work towards maintaining that,” he said. Bikita Minerals coach Saul Chaminuka was an angry man after the final whistle. The veteran gaffer, who is widely believed to be on his way to Green Fuel this week to take over the role of head coach where he will be assisted by Taurai Mangwiro, was not happy with the match officiating. “There is no way we can develop as a nation in this game with this kind of match officiating. Surely, my players being kicked, even in off the ball situations, but the referee waves play on. It is unfortunate that we coaches when we complain about referees, we are crucified, so I will not comment about this match,” fumed Chaminuka. Manica Diamonds: Godfrey Chitsumba; Lawrence Masibera; Farai Banda; Tawanda Chisi; Thubelihle Jabulani; Jefrey Takunda; Garikai Dematsika; Enoch Karembo; Panashe Mutasa (Micheal Tapera, 46th minute); Gerald Bero (Charles Teguru, 46th minute); Fortune Binzi Bikita Minerals: Francis Tizai (Victor Machopa, 46th minute); Prince Mlanzi; Blessing Kagudu; Munzabwa Carlton; Nhongo Dennis; Barnabas Mtuche; Allen Gahadzikwa (Praise Tonha, 46th minute); Benedict Bera Kudakwashe Sibanda, ; Evans Katema (Russel Madamombe, 65th minute); Chris Makamba; Enock Moyo (Tawanda Mlenga, 65th minute) "
