Link,Title,Content
https://www.herald.co.zw/baptism-of-fire-for-kwinji-15/,Baptism of fire for ‘Kwinji 15’,"Tadious Manyepo Sports Reporter MIGHTY WARRIORS legend Sithethelelwe “Kwinji 15” Sibanda suffered a setback in her first assignment in charge of title hopefuls Chapungu Queens, after suffering defeat to defending champions Herentals Queens, in a Women’s Super League tie at the National Sports Stadium B-Arena on Saturday. Sibanda, who has previously made waves in the Mighty Warriors dugout, showed some clout when leading FC Platinum Royals to a strong finish last season. And she is expected to finally end Chapungu Queens’ wait for a maiden title this season. But she will have to reorganise her charges after they failed to work out a formula to repel champions Herentals Queens, who made history by winning the crown without suffering any defeat last season. The tie was the pick of the league’s opening weekend and it lived up to its billing, with both teams displaying quality in a match that attracted a lot of spectators. Herentals Queens, after missing some good chances just like their opponents in the opening phase, came good through the boot of 2022 Soccer Star of the Year Praynance Zvawanda in the second half. Though Chapungu Queens tried hard to crawl back with the fit-again Ethel Chinyerere rattling the cross-bar, the Simbarashe Dedza side held on to start the defence of their title on a positive note. Sibanda though noted some good signs from her team which she hopes to build ftom going into match day two of the championship. “Herentals are a big team and we are fighting to be in the top there. The aspirations have never changed. “It was a very good game, very physical. I noted a lot of positives from my team,” said Sibanda. “We need to work on some slight things like concentration especially analysing how we conceded. We were winning the second ball and really played well. We just need to make sure that we play well. “This is a marathon, there are still a lot of games to play and a lot of things to fix. We have a very strong squad and we are looking forward to doing well.” Dedza, whose girls will be representing the country in the Women’s CAF Champions League Zonal qualifiers in South Africa in August, said the Students need to maintain the winning spirit. “Chapungu is a very strong team but my girls showed a lot of character,” Dedza said. “This is a long marathon and we need to keep on having the right mentality that helps us get the results.” Elsewhere, Shamaine Kapachi hauled four goals to help FC Platinum Royals dispatch MSU Queens 7-0, while Greater Bhande, Chiedza Paraganda and Kudakwashe Basopo grabbed a hattrick each to help their teams to comfortable wins. Bhande got three goals in Black Rhinos’ 7-0 win over ZRP Harare, with Paraganda’s triple strikes seeing Conduit sprint over the line against Hope Academy in a 5-0 victory for the Guruve team. Basopo’s hattrick came in the weekend’ most thrilling game where the former Mighty Warriors star helped Black Mambas Queens to a 4-3 win over Maningi. Women’s Soccer League Results Herentals Queens 1-0 Chapungu Queens Black Mambas 4-3 Maningi Platinum Royals 7-0 MSU Queens Highlanders Royals 4-1 Mutare City Conduit 5-0 Hope Academy Faithdrive Queens 0-1 Harare City ZRP Harare 0-7 Black Rhinos "
https://www.herald.co.zw/dynamos-herentals-in-controversial-draw/,"Dynamos, Herentals in controversial draw","Tadious Manyepo Sports Reporter Dynamos . . . . . . . . . . . . . . . . . . . . .   (1) 1 Herentals . . . . . . . . . . . . . . . . . . . . .  (0)1 MATCH officials hogged the limelight as a low-key Castle Lager Premiership Harare derby between Dynamos and Herentals ended in a controversial draw at Rufaro yesterday. Far side assistant referee Kudzanai Hiya, who flagged Herentals’ Dreamer Liye’s opener for offside with 27 minutes on the clock, again raised his flag when Donald Dzvinyai appeared to have secured the points for Dynamos. With DeMbare players sprinting to celebrate and later confront Hiya, Herentals quickly started play and as they were going clear of goal, the Dynamos bench, led by goalkeepers’ coach Britto Gwere rushed into the pitch to curtail the attack. Apart from the controversy of disallowed goals, the  ‘dirty’ match was characterised by crude tackles and every aspect of tension. After missing an array of chances in the opening half hour, Nomore Chinyerere broke the ice with a fortuitous finish, benefiting largely from poor goalkeeping by Takudzwa Chikosi, who fumbled the tame effort letting it slide in between his legs, with 31 minutes played. With the Glamour Boys tiding things up to the break, they had no answers to the Students’ raids, with substitute Milton Chimedza coming to the end of Tino Benza’s cross after 66 minutes. Dynamos gaffer Genesis Mangombe decried his team’s failure to utilise their opportunities. “We should try and make sure that we score goals whenever we get chances. I think we got so many chances in the first half, but we failed to score,” said Mangombe. “Some of these decisions are costing us at the end of the day, but I am not a referee. “If it’s a goal, it’s a goal. Even in their (Herentals) goal, I thought there was an infringement on Jalai (Emmanuel). “We scored a clear goal, but it was disallowed.” His Herentals counterpart, Paul Benza, said he was not qualified to comment about match officiating although Liyeto’s first half goal appeared to be legitimate. “I don’t qualify to comment about match officials,” said Benza. “The game was good and I thought my players did very well. “I am happy and disappointed at the same time. I think we should have won this match but it is some of those things that happen in football. “But the fighting spirit from my lads was amazing.” Dynamos should have opened the scoring inside 19 minutes but Elton Chikona failed to direct his effort well when shrugging his markers inside the box. Five minutes later, Donald Mudadi managed a low shot but it was parried away by Chikosi.  Herentals took their points tally to 11 while DeMbare are now on 12 points, eight behind leaders Manica Diamonds. Teams   Dynamos Tatenda Makoni, Emmanuel Jalai, Nomore Chinyerere, Donald Dzvinyai, Kevin Moyo, Donald Dzvinyai, Emmanuel Ziocha (Temptation Chiwunga 65min), Fredrick Ansah-Botchway (Brendon Jeremani 87min), Valentine Kadonzvo (Alexander Mandinyenya 58min), Emmanuel Paga, Elton Chikona (Keith Madera 65min) Herentals Takudzwa Chikosi, Godfrey Mukambi (Ali Maliselo 62min), Zibusiso Ruguchu, Joseph Chitavira, Tinashe Mupumha, Blessing Phiri, Brighton Majarira(Webster Dombo 75min), Dreamer Liyeto (Tanaka Dhlakama 31min(Blessing Majarira 62min), Tinotenda Benza, Innocent Benza (Milton Chimedza 46min), John Zhuwawo "
https://www.herald.co.zw/arsenal-go-top-of-the-premier-league/,Arsenal go top of the Premier League,"Manchester. — Arsenal kept their Premier League title dreams alive by ending an Old Trafford hoodoo to grind out a 1-0 win at Manchester United yesterday to move back top of the table. Leandro Trossard scored the only goal on 20 minutes as Arsenal won for just the second time in 17 games away at United to go a point clear at the summit. Manchester City still have the destiny of the title in their own hands as the defending champions have two matches left to Arsenal’s one. However, the Gunners kept the pressure on Pep Guardiola’s men ahead of their tricky trip to Tottenham on Tuesday. Defeat further dented United’s chances of competing in Europe next season. Erik ten Hag’s men showed more spirit than in a dismal 4-0 defeat to Crystal Palace on Monday, but have now won just one of their last eight Premier League games. United remain eighth in the table, three points adrift of both Newcastle, who they face on Wednesday, and Chelsea. Arsenal have been in scintillating form in 2024 to remain in the race for their first league title in 20 years. Mikel Arteta’s men have won 15 and drawn one of their 17 league games since the turn of the year. But Arsenal were far from their flowing best as the expected onslaught of an injury-ravaged United never materialised under unusually stifling heat in England’s north-west. The manner of defeat at Palace had increased the scrutiny on United boss Ten Hag. He made three changes to the team swept aside at Selhurst Park as Scott McTominay, Sofyan Amrabat and Amad Diallo came in. The Dutchman’s options were again hamstrung by a lengthy list of absentees with captain Bruno Fernandes among those sidelined and a bench littered with youngsters. But his decision to retain Casemiro as a makeshift centre-back after his woeful showing against Palace will become another stick to beat the beleaguered coach with. The Brazil captain was dropped from their squad for the Copa America in midweek due to his terrible form. After United had managed to keep the free-scoring visitors at bay for the opening 20 minutes, Casemiro was culpable for the opening goal. The 32-year-old was laboured in pushing up from a United goal-kick to play Kai Havertz onside and Trossard then stole in on the blind side of Casemiro to tap in the German’s cross. United’s new co-owner Jim Ratcliffe was in attendance at Old Trafford rather than at Wembley to see the club’s women pick up their first ever major trophy in the FA Cup final. The work that lies ahead of Ratcliffe has been laid bare in recent weeks, but the home side did manage to keep the majority of the 74 000 crowd onside by taking the game to Arsenal after the break. Arsenal, though, were rarely seriously troubled as they held out for a sixth clean sheet in their last seven away league games. Alejandro Garnacho was United’s one live wire but smashed into the side-netting with his best chance to equalise. Gabriel Martinelli and Declan Rice were denied by brilliant Andre Onana saves to prevent Arsenal the second goal they craved to avoid a tense finale. The visitors desperation to see the game out was evident as Martinelli took the ball to the corner with 10 minutes of the 90 still to play. But Arsenal did just enough to ask the question City, who host West Ham on the final day of the season after their visit to north London in midweek. — SuperSport. "
https://www.herald.co.zw/785748-2/,Hollick wins Zimbabwe Open,"Eddie Chikamhi Senior Sports Reporter SOUTH African golfers continued to dominate the field after Michael Hollick romped to victory in the 2024 FBC Zimbabwe Open Golf championship at Royal Harare on Sunday afternoon. Hollick finished with a 20-under-par 268 after an epic final day against countryman Darren Fichardt, who pushed him to the limit with his 18-under-par. Zimbabwean Scott Vincent was in third place with a respectable 14-under after a feisty last two days on the course. His brother Kieran Vincent also put up a commendable show, tied for fourth place with Swedish golfer Frederick From. Another Zimbabwean Ben Follett-Smith was sixth on 11-under while top Zimbabwean junior Matthew Bramford, was the top amateur after finishing for 38th place, with a course par score 288. "
https://www.herald.co.zw/legendary-zim-duo-shines-at-cosafa-awards/,Legendary Zim duo shines at COSAFA awards,"Eddie Chikamhi Senior Sports Reporter ZIMBABWEAN players and officials may not have won any awards at the at the inaugural COSAFA awards in South Africa on Thursday but the country was represented on the podium by legendary former Warriors coach Sunday ‘Mhofu’ Chidzambwa and ex-referee Felix Tangawarima who were honoured with Lifetime Achievement Awards by the Southern African football body. Chidzambwa, who is the most successful coach in COSAFA Cup, was presented with a Lifetime Achievement in Services to Coaching while Tangawarima’s efforts were acknowledged with the Lifetime Achievement in Services to Refereeing. Coming just a few years after retiring from active coaching, Chidzambwa should have found great cheer from the recognition as it is not every day that local officials get such recognition for their efforts. The 72-year-old coach has made extraordinary accomplishments in the COSAFA Cup, where he has won a record four titles and never lost a match outright. The former Dynamos and Zimbabwe captain and coach lifted the COSAFA Cup in 2003, 2009 on home soil and the 2017 and 2018 editions in Rustenburg and Polokwane, South Africa respectively. Only two other coaches, his late young brother Misheck in 2000 and Charles Mhlauri (2005) have ed Zimbabwe to COSAFA glory. Zimbabwe’s six titles are only second to Zambia who hold the record with seven and that is thanks largely to the mentorship of Chidzambwa, who has never been beaten outright in the COSAFA Cup after leading Zimbabwe in 19 matches in the tournament. The veteran coach has been keeping a low profile since he quit his job as Warriors coach in 2019, and from active football coaching a year later. However, the former defender briefly bounced back for a once-off assignment when he led the Warriors against Namibia during the celebrations to mark President Mnangagwa’s inauguration last year. Previously he had several stints with the national team and holds the distinction of being the first to lead the Warriors to their maiden Africa Cup of Nations in 2004. He guided the team to the tournament again in Egypt in 2019. The 72-year-old mentor raked several trophies with Dynamos at the height of his caching career and took the popular club to the final of the 1998 CAF Champions League. It remains the only time that a local club has reached the final of a continental club competition. Tangawarima, a revered figure across the African refereeing fraternity, has done much to develop match officials on the African continent in the last few decades, but especially Southern Africa, and was awarded with a Lifetime Achievement for services to refereeing. Tangawarima, who is now as a CAF senior referees’ instructor, has worked extensively for the development of the refereeing standards in Eastern and Southern Africa. A deeply religious man, Tangawarima paid tribute to his family and his United Methodist Church members for standing by him in long career as a match official. “I would want to thank COSAFA for bestowing me with this prestigious award. “I have all been passionate about doing my job, especially developing and leading the referees throughout the entire continent,’’ Tangawarima said. “But being recognised in this manner is something I will always cherish for years to come. “Again, I would want to thank Zimbabweans in general for the support they have given me over all these years. “Sometimes, they may not know what it means to me when they talk positive things about how I do my work. It always encourages me to continue working hard so that I don’t let them down. “My family has also been a pillar of my strength. “My football family in Zimbabwe and the football association, I cannot do this without belonging to the mother body (ZIFA). “My colleagues at my church Inner City United Methodist Church for all the prayer session they do for me.’’. Tangwawarima said he also felt even more honoured to receive the award in the presence of the Sports and Recreation Commission and the ZIFA Normalisation Committee leadership. “I was humbled to have the chairman of the SRC (Gerald Mlotshwa), the director-general (Eltah Nengomasha), together with commissioners Nigel Munyati and others, the NC chairman Mr Lincoln Mutasa, witnessing the occasion and taking pictures with me, this gave me a huge sense of belonging and being loved. “I also thank the media for always highlighting the work I would have done, which resulted in me getting this award. “I am sure this award will inspire upcoming sportspersons to know that they can do it, with hard work and commitment.’’ Some of the local referees and coaches who have been found wanting in their duties could probably take a leaf from each of Chudzambwa and Tangawarima’s success stories. The awards night, however, belonged mainly to the players and coaches who walked home with various accolades. Held for the first time in the history of COSAFA, the ceremony at the exquisite Sandton Convention Centre on Thursday drew some of the luminaries of the game from this part of the continent and was a platform to celebrate success in 2023. South African striker Percy Tau and Zambian forward Racheal Kundananji took home the best player prizes at the inaugural awards, itself a glittering gala ceremony. COSAFA executive director Sue Destombes said the organisation was proud to have finally put together an event to acknowledge the talent in Southern Africa. “These awards have been a long time coming as we felt there is the need to celebrate our successes as a region and show the togetherness and spirit of Ubuntu that we have among all our COSAFA nations. “We have enormous talent on and off the pitch and while we do acknowledge these winners for their outstanding contributions, we also recognise that there is much more for us to do to unlock the full potential we possess in Southern Africa,” said Destombes. "
https://www.herald.co.zw/mapeza-pleads-for-patience-with-refs-ahead-of-bosso-tie/,Mapeza pleads for patience with refs ahead of Bosso tie,"Onward Gangata FC Platinum coach Norman Mapeza has pleaded with the local football community to be patient with referees ahead of his side’s top of the table clash against Highlanders at Barbourfields tomorrow. There have been growing concerns over the decline in the standards of match officiating in the local game. In acts of misconduct that only serve to shame the Premiership, two matches have so far been abandoned due to crowd trouble and teams protesting referees’ decisions. FC Platinum’s clash against CAPS United at Mandava was abandoned in the 86th minute with the miners leading 1-0. Mapeza’s men were eventually awarded the points via a disciplinary committee ruling that also slapped CAPS United with a US$4000 fine. Chegutu Pirates have been summoned to a hearing by the PSL following the abandonment of their match against Dynamos at Baobab where the newboys refused to let the game restart as they protested an injury-time goal scored by DeMbare. For all the attacks levelled against the referees, Mapeza, has, however, come out in defence of the match officials. The Zimbabwe skipper and coach, who last year threatened to quit the game over biased officiating, urged patience with the match officials. He argued that the game’s stakeholders needed to also understand that referees are prone to mistakes “like any other humans’’ and that the errors are part of the game. “Everybody should know that in a game of football you win, you lose and you draw,’’ said Mapeza. “Whatever the referees are going to do let us respect that, otherwise if we are not going to respect the referees then there are going to be problems.’’ An explosive encounter is on the cards after FC Platinum eased into third place and a point behind leaders and Manica Diamonds who both have 19 points. Depending on how Manica Diamonds fare in the Eastern Region derby clash with Bikita Minerals, FC Platinum could go top should they overcome Bosso. Mapeza pleaded with the fans, especially, to exercise restraint when protesting referees’ decisions. And Mapeza pleaded with the supporters that even when match officials make grave mistakes, supporters must always exercise restraint. “We have to respect the referees…we saw what happened in that match between Real Madrid and Bayern Munich and was there any crowd trouble? No! “Why can’t we learn from that “Referees are also human, they make mistakes and we should accept that, if we really love our football, we should respect referees’ decisions.’’ Mapeza said. "
https://www.herald.co.zw/beitbridge-community-pins-psl-hopes-on-dulibadzimu/,Beitbridge community pins PSL hopes on Dulibadzimu,"Curtworth Masango THE Beitbridge community is hoping to have one of their local teams bounce back into top-flight football after a lengthy period in the lower leagues. Clubs like Border Strikers, Under Hill, and Triple B altogether have had a dance in the PSL before they found themselves relegated to the lower leagues. Now, if the form that has been displayed by Dulibadzimu in ZIFA Central Region Soccer League is anything to go by, the Beitbridge community is hoping they might be having top-flight football back in their community soon. After six games, Dulibadzimu, who are under the guidance of Stanley Ncube, are in pole position with 16 points, four points clear second-placed Dinson Mvuma. Their impressive run consists of five wins and a draw. They are hoping to continue with their unbeaten run tomorrow when they face Blanket Mine away at Long John. In their last encounter, Dulibadzimu edged one of the favourites, Chapungu, by a goal to nil to make a strong case of themselves. But for Dulibadzimu chairman, Ephart Chikweza Shoko, the team is just focusing on improving their game and finish in a better position than they did last season, anything above that is a bonus for them. The club finished sixth last season with TelOne being crowned champions. “As a team, our target is to improve from what we did last season. We finished in position six and we are aiming to finish in a better position this season,” said Shoko. “Honestly, if we gain PSL status, that will be a bonus for us as we are not favourites in this marathon. But it’s best for us to maintain the position if possible, the whole football community of Beitbridge will be happy as it has been long since we have had a team from here in the top-flight. We all remember the past, it was good having our teams playing in PSL and we want to have that feeling again. “As a club we have a way we are doing things, we have trusted in continuity as we have kept the bulk of most of our players from last season and added a few players who we felt they might add value and I think it’s working. “So as the club’s executive of a community team we are just there to make sure that the community of Beitbridge at large is happy and we are ready to deliver what they expect from us,” he said. "
https://www.herald.co.zw/chevrons-slump-to-fourth-t20i-defeat-in-bangladesh/,Chevrons slump to fourth T20I defeat in Bangladesh,"Don Makanyanga Sports Reporter IT was a case of so near yet so far away for Zimbabwe as the Chevrons lost the fourth T20I match against Bangladesh by five runs at Sher-e-Bangla National Cricket Stadium in Mirpur last night. The defeat left the Chevrons facing a possible whitewash as they now trail the series 4-0 ahead of the last match of the series tomorrow. After winning the toss yesterday, Zimbabwe elected to bowl first and managed to restrict the hosts to 143 runs in 19.5 overs. The bowling innings became a tale of two halves for the Chevrons, with the first 10 overs being a struggle for Sikandar Raza and his men. Bangladesh put 100 runs on the board after 12 overs without losing a wicket. But they went on to crumble as they lost 10 wickets in the last eight overs of their batting innings. The openers Tanzid Hasan Tamim and Soumya Sarkar provided the hosts with a flying start after putting 101 runs on the board. But Zimbabwe got their first wicket at the start of the 12th over when Hasan (52) was caught out by Jonathan Campbell off a Luke Jongwe delivery. Jongwe was to strike again four balls later, in the same over, dismissing Soumya Sarka (41), which also proved to be a vital wicket for the visitors. The two wickets marked the start of the collapse of the Bangladesh batting line up as they went on to lose eight more wickets for meagre returns. Jongwe bagged his third for the day with Richard Ngarava and Brian Bennet each claiming two wickets apiece while skipper Sikandar Raza and Blessing Muzarabani got a wicket each. Eventually, Bangladesh were bowled out for 143 runs. Zimbabwe had an awkward start chasing their first win in four matches, as Bennet was dismissed with the fourth ball of the innings. Raza was the next to be dismissed in the fourth over for 17 runs off 10 balls. At the half-way mark, chances for Zimbabwe’s first win still looked probable despite the setbacks, as the Chevrons stood at 58 runs for the loss of four wickets. The fourth and fifth wicket partnerships of Clive Madande and Campbell, and Ryan Burl and Campbell gave Zimbabwe some hope before a characteristic Chevrons collapse set in. Wellington Masakadza who has had a good time with the bat in the series, put up another good performance as he scored an unbeaten 19 off just eight balls. His efforts were not good enough for the Chevrons as they went on to lose the match by five runs after the tail was cleaned up for 138 runs in 19.4 overs. "
