Link,Title,Content
https://www.manicapost.co.zw/new-tapera-strikes-again-to-send-gem-boys-top/,NEW: Tapera strikes again to send Gem Boys top,"The ManicaPost Ray Bande and Moffat Mungazi IN-FORM Manica Diamonds forward Michael Tapera was on target again as his solitary strike earned his team maximum points against plucky Bikita Minerals in a tightly contested Castle Lager Premier Soccer League match played at Sakubva Stadium today. The victory, the Gem Boys’ sixth on the bounce, saw them keeping another clean sheet to propel coach Jairos Tapera’s charges to the summit of the log standings with 22 points from 11 games. They now enjoy a one-point lead over former champions FC Platinum who defeated dislodged early pacesetters Highlanders 2-0 at Babourfields. Not only did Manica Diamonds collect the three points at stake, but also grabbed the bragging rights of a contest many may view as a derby since both teams are using Sakubva Stadium as their home ground. For red-hot Tapera, this was the fifth consecutive time he has found the back of nets as his team stays on the hunt for title glory. On current form, the Gem Boys have turned around their fortunes after enduring a sluggish start to the season; thanks to their sparkling form.   "
https://www.manicapost.co.zw/derby-delight-will-diamond-sparkle-or-lithium-will-lighten-up/,"Derby delight! . . . Will diamond sparkle, or lithium will lighten up?","The ManicaPost   Ray Bande
Senior Reporter THE better team of the day is highly likely to get both the three points at stake as well as the support from the terraces when Manica Diamonds host Bikita Minerals at Sakubva Stadium in a Castle Lager Premiership encounter set for Sunday. Both Manica Diamonds and Bikita Minerals use Sakubva Stadium as their home ground, and so far they have all enjoyed the backing of the hard to please Mutare football fans. With Manica Diamonds now on second position on the Castle Lager Premiership table following their sudden resurgence which has seen the Mutare diamond miners going for six consecutive matches collecting maximum points, Sunday’s league encounter presents yet another stern test of character for coach, Jairos Tapera and his men. On the other hand, Bikita Minerals have been enjoying considerable support of local fans each time they are at Sakubva Stadium due to their exciting passing game, a known trademark style of play for teams coached by veteran gaffer, Saul Chaminuka. Thus, Tapera, reckons the challenge posed by the lithium miners in their fine run. “We respect Bikita Minerals as they have been posting very good results. Remember, we are sharing the same stadium as our home ground, and the same supporters making it an interesting derby. “We are preparing well for this encounter. We will play with a positive mind. We have been doing well of late, and we would like to continue with that fine run,” said Tapera. The former Young Warriors gaffer attributes his club’s fine run to the hard work and commitment that all members of his team have invested in the project. “We attribute our fine run to hard work being put by the players. The level of commitment is just impressive. I believe this also has more to do with team work by both players and technical team,” said Tapera.    Bikita Minerals Saul Chaminuka He said they are not reading too much into their current position on the table, and are only concerned with collecting maximum points with each passing match. “We are not looking at the position we are at the log. It is still very early. We are just working hard to maintain the form and try and win as many matches as possible,” said Tapera. His opposite number, Chaminuka understands the enormity of the task ahead of him and his club. Chaminuka said: “This is the game of the year for both teams as either side knows how important winning this game is. “We are sister clubs fighting for bragging rights, and the good thing is that we are all home this week. The team that settles first and handles the fire thrown at it well will win. “Mutare fans are in for a treat this weekend. I promise them fireworks during Sunday’s match at Sakubva Stadium. Sakubva will be the best place to be after church.” Chaminuka hinted that he is staying put at Bikita Minerals after several clubs expressed the desire to lure him. “I am at Bikita and this Sunday, I want our fans to concentrate on pushing our boys so that we come out of this one with maximum points. We want to amass as many points as we can so that we end this first round with points that will see us instead of being threatened with relegation, we will be fighting for a top six finish. “I believe that achievement will be like winning a title in our debut season. My message is, let us see what we started through together. Our God whose name is Jehovah will lead the way as always,” said Chaminuka.   "
https://www.manicapost.co.zw/99-undergo-toecs-in-mutare/,99 undergo TOECS in Mutare,"The ManicaPost   Ray Bande
Senior Reporter   A TOTAL of 99 participants from different parts of the country converged at Sakubva Primary in Mutare recently for the highly rated International Athletics Referees’ Course Level One, a crucial stage in the globally acceptable Technical Education and Certification Officiating Systems (TOECS). The 99 were drawn from Manicaland (64), Masvingo (14), Midlands (three), Mashonaland West (three), Mashonaland Central (eight), Matabeleland South (one) and Mashonaland East (six). The course was organised by Mutare Athletics Board in conjunction with the Manicaland Athletics Board. Participants in the course went through lessons in entries in competitions at international standards, attire, officials’ categories, running events, field events (jumping and throwing events), race walking, combined events (heptathlon, octathlon, and decathlon), indoor athletics and anti-doping. International instructor, Irene Chineka, one of the only three instructors in Zimbabwe, was the chief facilitator during the well-attended course. Chineka said: “This is the third course of its nature that we are having this year around the country, and we are happy with the response we are getting from our targeted participants. It really shows that we have come of age in athletics as we now understand the importance of technical expertise in managing our competitions. “It is important to note that this course is crucial in enhancing the professional approach to athletics competition management, and it is recognised globally. These participants can officiate anywhere under the sun with this qualification. Therefore, we congratulate them for the sacrifice they have made to be here, and hopefully, they will play an important role in nurturing our budding athletes.” Mutare Athletics Board chairperson, Godfrey Ndinangepi, who was also the assistant facilitator during the recent course at Sakubva Primary School, said: “As Mutare Athletics Board, one of the seven boards we have here in Manicaland under Manicaland Athletics Board, we are excited to have managed to host this event successfully. We strongly believe we have played a huge role in capacitating our athletics officials, and this should culminate into more professional handling of our competitions.”   "
https://www.manicapost.co.zw/batting-drug-abuse-away-through-cricket/,Batting drug abuse away through cricket,"The ManicaPost   Liberty Dube
Sports Correspondent CRICKETERS and sports personalities have been urged to take a firm stance against performance-enhancing drugs and abuse of other drugs and substances as they can have detrimental effects for both the individual athlete and the integrity of the sport. Addressing young cricketers and sportsmen at Mutare Sports Club last Saturday, Minister of State for Manicaland Provincial Affairs and Devolution, Misheck Mugadza said a nation with drugged people cannot develop. The event was hosted by the Premier Cricket Academy and was held under the theme: “Batting Away Substance Abuse”. “We must take a stand and actively work towards creating a society that is free from the clutches of substance abuse. Only a healthy society can stand resolute to develop its country. Just as you use your skills and determination to bat away every ball that comes your way, we must collectively work to bat away the lure of drugs and substance abuse from our communities. “As cricketers, you have a unique platform to inspire and educate the masses. Your dedication, teamwork and perseverance on the sports field are qualities that many look up to and aspire to emulate. It is, therefore, crucial that you recognise the influence you have, and use it to advocate for a drug-free society. The use of drugs in sport and in the society, not only affects the individual, but also has a profound impact on families, communities, and the nation at large. “More importantly, let us band together, like a strong cricket team, to bat away substance abuse. Let us educate, support and empower our communities to make informed decisions and reject the allure of drugs. Together, we can be champions, not only in cricket, but also in the fight against drug abuse,” said Mugadza. He added that drug and substance abuse also has health implications. “For example, anabolic steroid abuse result in cardiovascular problems, hormonal imbalances and increased aggression. Stimulant abuse can cause heart problems, anxiety and addiction. Additionally, the use of blood doping techniques can lead to blood clotting, stroke and other cardiovascular complications. Our dear cricketers, use your influence to spread awareness, support anti-drug initiatives, and be vocal advocates for a drug free lifestyle. Your actions, both on and off the field can inspire positive and change the world,” he said. Manicaland cricket administrator, Terry Nyakurimwa said: “The use of drugs and substance abuse by youths is now a major concern. We urge kids to come and play cricket and shun all social ills.”   "
https://www.manicapost.co.zw/gains-of-mwana-rugby-festival/,Gains of Mwana Rugby Festival,"The ManicaPost   Ray Bande
Senior Reporter   THE 2024 edition of the rebranded Mwana Rugby Festival has come and gone, but the boost in talent development at national scale will remain its greatest legacy, while participants from Manicaland Province are still counting the sporting as well as social gains of having been part of the 120 schools that took part in the competition. Mavhudzi High, one of the three schools from Manicaland that participated in the competition held in Harare last week, played three matches like the rest of the teams that participated. Of those three matches, Mavhudzi played against Dzivarasekwa, Tichakunda and Pathway Group of Schools. They won the first match, drew the second and lost the last one. Mavhudzi High School coach, Takudzwa Mudzuka, said: “It was a learning curve for the team as a whole, and hopefully we will have three wins during the next edition of the tournament. We played very well during our first two matches, but injuries saw us having five key players being retired to the bench during the last match. “Everyone played well, but our captain, Ashley Tsar Chimbandidza and Blessing Boika Murangwana were instrumental in rallying the team.” Marist Nyanga and Mutare Boys’ High School were the other two schools that participated. Mwana Group proprietor, Kuda Mutenda said: “Some of the success areas include the fact that rugby was played at all levels, by 120 teams (8am to 5pm, over seven days). This is the only rugby tournament which attracts a number of schools as they don’t have leagues during the year. “Long term infrastructural improvements and developments to the host school were also witnessed. More than 250 people were trained in five different courses (Level One Coaching, Level One Referees, Level One Medics, Sports Science and Sports Administration) free of charge to the participants. “People who normally do not watch rugby were given a chance to watch and enjoy rugby. In short, we gave hope to the country. ?50 talented and promising (boys and girls) athletes were selected for specialised further development to fully realise their potential over the next 12 months, with a regional tour to Zambia in 2024 in the pipeline. “It is also worth noting that this competition defied social barriers, as all social classes were represented and enhanced participation of women and the girl child, both on and off the pitch. “Lastly, but equally important is the fact that we aggressively campaigned against drug abuse through the whole festival, with over 1 000 learners going through counselling sessions from qualified doctors and counsellors from Drug Free Zim,” said Mutenda. Manicaland Rugby Board chairperson, Mos Kapumha, said: “We would like to appreciate the school heads who made it possible for their schools to be part of this national festival, the biggest and longest running in Zimbabwe – The Mwana Festival. “The players, both boys and girls, were given good quality opponents and exposed to the country’s finest rugby playing schools. The coaches’ tactics and credentials were put to test. “A big thank you to the organiser, Kuda Mutenda and his Mwana Festival committee for embarking on this journey and giving our learners a platform and opportunity to express their talents, skills and humility on such a grand stage. “We have 10 rugby referring officials who were part of these games. They were giving their services and also horning their skills. One of them was Eve Chisingarambwi, a new certified Rugby Africa match commissioner. It was a first for Manicaland. The Mwana Festival Super Week also came with a training and education programme which saw three Manicaland participants, two ladies and one male getting certified across different strands accredited by World Rugby.”   "
https://www.manicapost.co.zw/i-feel-so-sorry-for-him-no-kane-no-gain-for-bayern/,"‘I feel so sorry for him’ – No Kane, no gain for Bayern","The ManicaPost   WHEN Harry Kane was on the pitch, Bayern Munich were heading to the Champions League final.   When he wasn’t there, they weren’t — and aren’t. Thomas Tuchel substituted Kane in the 85th minute against Real Madrid.   At that point, Bayern were protecting a one-goal lead and were going to Wembley with the England captain having led their charge. So while there are other factors in play — notably Manuel Neuer’s error as he spilled the ball to allow Joselu his first of a dramatic late double, plus Madrid’s innate ability to win big European games even when hope seems lost — the substitution has been pinpointed as the turning point. It also encapsulates what the 2023-24 season has been for Bayern — a campaign where they have looked lost when without Kane. And now, Kane ends his debut campaign at Bayern with nothing. “He has done his job. He has scored the goals,” Champions League winner Rio Ferdinand told TNT Sports. “They brought him to continue winning trophies and I feel the others have let him down more than anything. I think he will have a heavy heart tonight.” While Bayern were after the seventh European Cup in their history, Kane was looking for the first major trophy of an otherwise stellar career. Certainly, this season could not have been better from an individual perspective for Kane, scoring 44 goals in all competitions — his best ever scoring season. Yet while Kane has shone, this flawed Bayern side have fallen short and will end the season without a major trophy for the first time since 2011-12. “I feel so sorry for Kane. What a superstar he has been and he doesn’t have an opportunity [in a Champions League final],” former Bayern midfielder Owen Hargreaves told TNT Sport. “Poor guy. He has been amazing this season and that just didn’t go to plan in the last 10 minutes.” In that 2011-12 campaign when Bayern finished empty-handed, Kane was finishing a season on loan from Tottenham to Millwall, where he scored seven goals in 22 League One games and was still a year away from his Premier League debut. This season, he has almost singlehandedly tried to drag Bayern to glory. Bayern’s second highest scorer, Jamal Musiala – also subbed off in Madrid – has just 12 goals in all competitions. However, hampered by poor performances and bad decisions around him, Kane has come up just short. Bayern lost their 11-year grip on the Bundesliga title to Bayer Leverkusen, were knocked out of the German Cup by third-tier Saarbrucken and now they will be stunned having seemed set for an all-German final in the Champions League. After a quiet opening quarter of the match at the Santiago Bernabeu, Kane sprung to life with a snap volley from the D in the 28th minute which Andriy Lunin had to go full stretch down to his left to save. But Bayern around him were again off the pace, with a passive showing that saw Madrid dominate. Only a series of fine saves from Neuer kept the tie level, until Kane made his most telling intervention. Alphonso Davies’ strike with his supposed weaker right foot to put Bayern ahead on the night caught the eye, but it was Kane who made the play by dropping deep, then spraying an idea pass out to the left for the Canadian full-back to take on, cut inside and fire home. Kane’s value to Bayern stretches way beyond goals.   He even led the complaints to the referee when Nacho shoved Joshua Kimmich in the face before Madrid appeared to have equalised, prior to the goal being ruled out by VAR. But then came the turning point, as with five minutes remaining Tuchel replaced Kane with Eric Maxim Choupo-Moting as part of a series of changes to try and see out the match. “That will be viewed as the moment Tuchel lost this for Bayern,” German football expert Archie Rhind-Tutt told BBC Radio 5 Live. “You could see it in his facial expression after the second Madrid goal went in – he looked shaken. He usually has a very good poker face, Tuchel. That for me was a guy who knew it had all gone wrong.” Tuchel, due to depart at the end of the season, defended his call, saying Kane was in no state to continue. “He couldn’t keep going. He played with back pain and he couldn’t keep going, his back froze up,” Tuchel said. Shortly before Kane came off, Choupo-Moting’s fellow former Stoke City player Joselu was thrown on by Madrid boss Carlo Ancelotti — and he snatched the striking glory. As the Real players streaked on to the pitch to celebrate Joselu’s winner, Kane was left in the away team dugout to wonder what might have been. – BBCsport.   "
https://www.manicapost.co.zw/maradonas-stolen-golden-ball-to-be-auctioned-off/,Maradona’s ‘stolen’ Golden Ball to be auctioned off,"The ManicaPost   DIEGO Maradona’s “stolen” Golden Ball trophy, awarded for being named the best player at the 1986 World Cup, has been found and will be auctioned off in France on 6 June. The Aguttes auction house announced on Tuesday that the item had resurfaced and they expect it to be sold for “millions”. Maradona, who died in 2020, won the award after leading Argentina to World Cup victory in Mexico. “There are a lot of stories and legends, like it was stolen by the mafia to make gold,” the Aguttes auction house sport expert Francois Thierry told BBC Sport.   “We did all the necessary checks and called the police about it. “We have had the ball for about one year. We did a lot of research about it since there are a lot of details in terms of manufacturer comments until we could say it was a good one.” The Golden Ball was bought by the anonymous seller in 2016 at an auction in France. However, he was unaware what item he had purchased. “He bought it with many other things, at the beginning he did not know it was something important,” Thierry added. “In the case he bought there were a lot of trophies. He then searched on the internet and found it could be the Golden Ball. “He tried to call Maradona and Fifa, but had no luck.” The 1986 World Cup arguably is best remembered for Maradona’s two goals against England in the quarter-finals. Maradona outjumped England keeper Peter Shilton to punch his first goal into the net with a raised fist, which was later described by the Argentine as being scored by the “Hand of God”. His second was voted as the “Goal of the Century” in a Fifa poll, Maradona dribbling from his own half past five English players to score. Both the jersey he wore that day, along with the ball from the match, have previously been sold at auction for millions. “The trophy symbolises the pinnacle of his career and he is the player of the century,” Thierry said. “We can see there were some results from before when his jersey against England in 1986 being sold for I think £9m and the ball of the game went for £2m, so we expect millions.” — Online.   "
