Link,Title,Content
https://www.manicapost.co.zw/i-dont-trust-anyone-how-trolling-hurt-kipchoge/,‘I don’t trust anyone’: How trolling hurt Kipchoge,"The ManicaPost   TWO-TIME Olympic champion Eliud Kipchoge says he feared for the lives of his family during a campaign of online abuse that wrongly linked him to the death of fellow Kenyan marathon runner Kelvin Kiptum. Kiptum, the world record holder who looked set to challenge Kipchoge’s dominance over 26.2 miles, died aged 24 in a car crash in February. Some social media users began to speculate that Kipchoge was part of a conspiracy to kill Kiptum, who had lowered the world best to two hours, 35 seconds last October in Chicago. “I was shocked that people [on] social media platforms are saying ‘Eliud is involved in the death of this boy’,” the 39-year-old told BBC Sport Africa. “That was my worst news ever in my life. “I received a lot of bad things; that they will burn the (training) camp, they will burn my investments in town, they will burn my house, they will burn my family. “It did not happen but that is how the world is.” Kipchoge’s initial reaction when he saw the abuse and false rumours was to check whether his family were safe. “I don’t have power to go to police and tell them my life is in danger. So my concern was actually to tell my family to be extra conscious and cautious,” he said. “I started to call a lot of people. “I got really scared of my children going to school and coming back. “Sometimes they bike around, but we had to stop them because you never know what will happen. We started to drop them [off] and pick them [up] in the evening. “My girl was in boarding school – that was positive that she had no access as far as social media is concerned – but it’s tough for my boys to hear ‘Your dad has killed somebody’.” Kipchoge was overtaken by emotion during a candid interview at his home in Eldoret when discussing the impact the campaign of abuse had on his mother. “My worst moment was (when) I tried to call my mum,” he said. “She told me ‘Just take care’ and ‘A lot has been going on’. “Where I come from is a really local area. And with the age of my mum, I really realised that social media can go everywhere. “But she gave me courage. It was really a tough month.” However, Kipchoge, who became just the third person to win successive Olympic marathons when he defended his title in Tokyo in 2021, decided not to take precautions over his own safety. “I saw no meaning to change training venues because my life is open,” he explained. “Our sport is not training in the gym, it is going outside to run. I walk in the streets freely.”
Kipchoge claims he “lost about 90 percent” of his friends amid the wrongful link to Kiptum’s accident and online abuse. “It was really painful for me to learn even from my own people, my training mates, those who I have contact with, and the bad words are coming from them,” he added. “I was really down to see that.” Kipchoge’s team decided to take the distance runner off social media in the wake of the abuse, but he said he never considered deleting his accounts. “If I delete my accounts then it shows that there is something I am hiding,” he said. “I will keep my accounts. I did not do anything.” However, he believes the social media abuse affected his performance in competition. Kipchoge came 10th in the Tokyo Marathon on 3 March, his lowest finish since his debut in 2013, crossing the line over two and a half minutes behind the winner Benson Kipruto. “When I was in Tokyo I had three days which I did not sleep,” he revealed. “It was my worst ever position.” Despite that setback he was named in Kenya’s marathon team for the Paris 2024 Olympics last Wednesday, and is now focused on creating more history at the Games as he aims to win a third successive gold medal. “It’s about getting up and going straight again, to your goal,” added Kipchoge, who in 2019 became the first person to run a marathon in under two hours, albeit in controlled conditions in Vienna. “I want to go into history books, to be the first human being to win back-to-back-to-back.”
Having been on the receiving end of intimidation and threats, Kipchoge believes social media companies are “not doing much” to clamp down on abuse on their platforms. “These faceless people are posting bad things and are really dangerous,” he said. “If you report some accounts then it takes time for them to delete those accounts. “They should act fast, get the facts, delete accounts. People [should] know that if you say something which is not good then your account will be deleted.” However, Kipchoge has welcomed an announcement from the International Olympic Committee that it plans to “respond proactively and at scale” to safeguard athletes from online abuse during Paris 2024. The IOC intends to use artificial intelligence, external to help identify abusive posts and report them to social media companies. “I think it’s actually the right direction,” he said. “They are now stamping their authority and their function as an organisation handling the athletes to safeguard them from abuse.” But, for Kipchoge, it is already too late to avoid the emotional scarring he has suffered.
“I learned that friendship cannot be forever,” he said. “I think it’s unfortunate that it happened when I’m celebrating over 20 years in sport. “What happened has [made] me not trust anybody. Even my own shadow, I will not trust.” — BBCsport.   "
https://www.manicapost.co.zw/manica-magic-dazzles-psl/,Manica magic dazzles PSL,"The ManicaPost   Ray Bande
Senior Reporter THERE is something crazy about the game of football — perhaps that is where its beauty lies! The first four rounds of the 2024 Castle Lager Premiership matches saw Manica Diamonds lying in the relegation zone on the log table — having conceded seven goals in four matches. In fact, after Match Day Three, Manica Diamonds anchored the log table. Amid speculation over his job, their coach, Jairos Tapera, even admitted that failing to get a win in the opening four matches of the season was worrisome. At that point, Tapera felt that the team’s defence was their weakest link. “As the head coach, I am very worried about the way we have been conceding, especially in our first two games, but we have been working very hard on that area (defence) and what we now need is to improve on our confidence,” he said then. Fast forward to five weekends, Manica Diamonds eased into the second position on the log table after an impressive five matches unbeaten run. And last Sunday, second half super substitute, Michael Tapera blasted a hard and low shot off a rebound after a corner kick to give Manica Diamonds their first triumph over FC Platinum since joining the Premiership, and also their fifth victory on the bounce. Against all odds, the club has been winning home and away, much to the amusement of Tapera. “We always attribute everything to God who has blessed us as a team to work and understand each other. These boys are all my sons. We have a father and son relationship, and always reflect on previous games and try to find information on our next opponents so that we can work on ways to overcome them. “We are a team full of ambitions, we really want to win something as a team,” said Tapera.    Manica Diamonds goalkeeper, Godfrey Chitsumba has also performed well between the sticks He believes the change of fortunes has been a direct result of shear hard work by all members of the team. “Every member of our team is putting a very strong performance. Yes, we can mention a few, but that will not take away what every player has put in, even those not selected on a particular day still work hard at training,” he said. The former Young Warriors gaffer admitted that winger, Michael Tapera was in a terrific form. Apart from sharing the same surname and team, the two namesakes are not biologically related. Apart from speedy winger, Tapera, who is nicknamed Chimudhudhudhu, goalkeeper, Godfrey Chitsumba has also been a vital cog in their transformation. Interestingly, it is the same defence that a few weeks ago has been leaking goals like a sieve, which has transformed into the solid bedrock of Tapera’s success story. “Yes, Michael Tapera has done very well for us with three goals in five matches. We also have Farai Banda who has two goals in as many matches. “We have our defence which has done very well with only a goal conceded in the last five matches. We also have our goalkeeper who has garnered four clean sheets in five matches,” he said. Manica Diamonds will face ZPC Kariba in their next assignment, and Tapera fully understands the threat posed by Kauya Kuturuturu. “It is very difficult to maintain form. We are going to ZPC Kariba, and this is even a more difficult assignment, considering that they have been performing very well in their recent matches. They have been posting impressive results at home and away. “We respect them a lot, but we are preparing and taking that match like any other important away game. We are going there to compete and give it all our best to get a positive result,” said Tapera.   "
https://www.manicapost.co.zw/saul-chaminuka-on-demand/,Saul Chaminuka on demand,"The ManicaPost   Ray Bande
Senior Reporter CASTLE Lager Premiership debutants, Bikita Minerals are holding on to him, GreenFuel and Hwange want him, while TelOne has placed a counter offer on the table to lure him. His name is Saul Chaminuka. After parting ways with head coach, Rodwell Dhlakama, the Chisumbanje-based Green Fuel-based outfit, whose turnover of coaches is fast becoming worrisome even to its sympathizers, is now chasing the signature of Saul Chaminuka. GreenFuel chairman, Fred Moyo confirmed their undying love for the experienced gaffer. “Yes, we are keen to have Saul Chaminuka on board. We are engaging him and our negotiations are at an advanced stage. We have every hope that he will settle for GreenFuel. Anytime from now we could be announcing his arrival at GreenFuel,” said Moyo. On the competition that his club is facing in signing Chaminuka, the GreenFuel boss said: “That is the nature of the game. Saul Chaminuka is a good coach, no doubt about that. Therefore, it is not surprising that many clubs are after him. However, I hope we will be able to meet and exceed his expectations.” The former now defunct Eastern Lions coach, Chaminuka is highly rated in domestic top-flight league as a shrewd tactician who can achieve results even with an average side. To lend credence to Chaminuka’s capabilities, Bikita Minerals did not have meaningful pre-season preparations as they were locked in some boardroom Premiership promotion issue that involved Tenax FC, but the team is competing favourably, playing an entertaining brand of football. This also explains Bikita Minerals’ reluctance to release the experienced gaffer. However, information gleaned by this newspaper indicate that Bikita Minerals are not adequately remunerating their players and coaches with unconfirmed reports that they are owed about four months’ salaries. This leaves the gaffer thinking twice should a striking offer be tabled.   "
https://www.manicapost.co.zw/sahumani-misses-mwana-rugby-festival/,Sahumani misses Mwana Rugby Festival,"The ManicaPost   Ray Bande
Senior Reporter IT’S two steps forward and one step backwards for the development of rugby in Manicaland after the once enterprising rural-based Sahumani Secondary School girls team failed to make the trip to Harare for this year’s inaugural Mwana Rugby Festival due to lack of resources. The festival was previously known as Dairibord Rugby Festival, which is arguably the country’s biggest annual rugby competition. The festival was previously bankrolled by milk and milk products producer, Dairibord, before takeover this year by Mwana Group, which manufactures vehicles accessories and doubles as a trucks and buses dealer. But it is this year’s absence of Sahumani Secondary School girls team — hailing from the undulating terrain and deep thickets of Honde Valley — that easily captures the attention of those who have been following their Cinderella story in the game of rugby. When the girls at Sahumani Secondary School started playing rugby back in 2017, they had to make do with the soccer pitch and the oversized football shirts used by the boys. Five years down the line, several of the girls ere representing the country in the sport, while girl rights activists credited the project for saving them from becoming child brides. Manicaland Rugby Board chairperson, Mos Kapumha admitted that the absence of Sahumani is testimony of lack of grassroots sport support in rural areas. “Our plea is for corporates, local businesspeople and politicians to help support the development of sport. This helps to bridge the gap between societies, be it either in sport or academics and at tertiary or school level. This lack of support also stifles the growth of the game in marginalised areas and demoralises the players and coaches who would have worked hard and sacrificed their time and effort, only to be let down on the 11th hour by lack of resources. “So there is need for collective support from parents, school administrators, community leaders and the business community to make sure that these players’ dreams are nurtured and actualised,” he said. However, Manicaland is not without its representatives at this year’s edition of the competition after Mavhudzi High boys and girls, Mutare Boys’ High and Marist Brothers Under-16 as well as senior teams are in attendance. “As Manicaland, we are pleased with Mavhudzi High, Marist Brothers and Mutare Boys’ High School’s participation at the inaugural Mwana Rugby Festival. “These teams were drawn from three districts out of seven. Sahumani failed to travel at the 11th hour from Mutasa North in Honde Valley due to lack of funds. “The participation of the three schools is good and shows that rugby is alive and thriving in schools in the province. It shows a great deal of commitment even from the school administrators towards sport and providing equal opportunities for their learners and a balanced curriculum. This also helps to prepare these schools for the upcoming national and provincial schools rugby league. Manicaland will have a schools’ rugby league starting in May when schools open. “Mutare Boys’ High and Hillcrest will be taking part in the CBZ national schools league. Manicaland schools will be busy this second term playing in structured rugby leagues provincially and nationally in line with the National Development Strategy (NDS1),” he said.   In the ongoing Mwana Rugby Festival which ends on Sunday, Mavhudzi was its Under-20 boys edging Dzivarasekwa 12-7 on Monday.   "
https://www.manicapost.co.zw/manyuchi-poised-for-epic-mutare-battle/,Manyuchi poised for epic Mutare battle,"The ManicaPost   Ray Bande 
Senior Reporter MUTARE is poised to host one of the biggest ever boxing event when Charles Manyuchi descends on the city for a blockbuster heavyweight bout against the province’s best pugilist — Anesu “The Guy” Motsi. The bout is being promoted by BoxAfrica Limited, an entity duly registered with Zimbabwe National Boxing and Wrestling Control Board, with jewellery firm, Betterbrands having expressed a keen interest to come on board as a principal sponsor. Betterbrands director and Mabvuku-Tafara Member of Parliament, Scott Sakupwanya is not new to boxing after sponsoring celebrated boxer, Floyd Mayweather’s visit to Zimbabwe in 2023. The visit was dubbed: “The Homeland Tour”. Themed: “The Grand Finale – KnockOut Drug Abuse Now,” the contest is being earmarked for this winter, with Sakubva Stadium being the preferred venue, albeit pending availability. Information at hand indicates that the promoter intends to include four boxers from Malawi on the rich fight card so as to give an international flair to the tournament. Manyuchi (34) who is arguably the most decorated boxer in the country, has since indicated that he is on the verge of spiking his gloves after an eventful professional career that earned him a total 13 international titles. These include the African Boxing Union welterweight belt, World Boxing Council international and silver, World Boxing Federation world, Global Boxing Union, Universal Boxing Union, World Professional Boxing Federation and the World Alliance Boxing Association supreme titles. In a journey that spans two decades, the sports ambassador boasts of 29 victories, 18 of them knockouts; four loses and a single draw in the professional ranks. It is this feat that earned him the Annual National Sports Awards’ Sportsman and Sportsperson of the Year gongs in two consecutive years – 2015 and 2016. He has also been twice hosted by the country’s two Presidents, and handed tokens of appreciation for having hoisted the Zimbabwe’s flag high. Promoter, Gilbert Munetsi, who is also Manyuchi’s publicist, advisor and biographer confirmed that plans are at an advanced stage to have Manyuchi fight before his fans in Mutare. “I can confirm that we have covered some ground in arranging this milestone event, and it is our fervent hope that Mutare folks will be treated to the best a promoter can offer in terms of a boxing bill. “I can confirm that we have now been given the greenlight by the boxing sanctioning board to have the tournament after meeting the initial requirements expected of us. “While we have had a positive discussion with Betterbrands, it is our hope that the business community in Mutare will also seize the opportunity and join hands with us. They will reap benefits from associating with the brand Charles Manyuchi. “It is an event that happens once in a lifetime, and the most beneficiaries in this arrangement remain the corporate sector and residents of Mutare in general,” he said.
Manyuchi, who was last in Mutare as a guest of Government when the province hosted the Zimbabwe National Youth Games some years back, said he is thrilled to take his act to Manicaland. “I love Mutare particularly for its hospitable people and the tourist attractions. But for me it is always business first. That “The Guy” has challenged me is testimony to his bravery. “I have followed his boxing journey and have to admit that he has what it takes to get to the top. I am in camp preparing for the Mutare tour of duty and I promise the fans the best of ‘The Busy Bee’,” he said. The developments come at a time when Motsi is on cloud nine after scoping a silver medal at the Mandela Cup competitions which took place in Durban, South Africa, recently.   "
https://www.manicapost.co.zw/nadals-emotional-farewell-to-madrid/,Nadal’s emotional farewell to Madrid,"The ManicaPost   RAFAEL Nadal’s Madrid Open run ended with an emotional straight-sets defeat to Czech youngster Jiri Lehecka under the roof on Caja Magica. In front of a passionate home crowd hoping to see the five-time champion conjure a fairy-tale run deep into the second week in what is expected to be his last appearance at the event, 30th seed Lehecka spoiled the party with a 7-5 6-4 victory in just over two hours. Immediately after the match Nadal said farewell to fans in an on-court interview as the tournament unfurled five banners marking each of his five victories in 2008, 2010, 2013, 2014 and 2017. “This is one of those days that when it arrives, it’s very tough, but life and my body have been sending me signals for a long time,” he said. “The dream was to finish here on court. I have been fortunate in my life to turn my passion into my job, I am privileged.” The 22-time Grand Slam champion arrived in Madrid saying he wasn’t fully fit and was worried about his condition, but in the end was celebrating having won three consecutive matches without showing significant physical limitations. Nadal had only one break opportunity against the big-serving Lehecka who has now won all of his three matches in straight sets. “It’s amazing to share a court with such a legendary player. It’s a dream come true; I always wished for this to happen,” Lehecka said. “I’m very grateful to achieve such a big moment and all the best to Rafa. It’s kind of bittersweet to have such a nice win in front of all these people who were cheering for him. The energy was amazing.” Alcaraz battles past dogged Struff Carlos Alcaraz was pushed to the limit, but found the answers when needed to overcome a gutsy Jan-Lennard Struff 6-3 6-7 (5-7) 7-6 (7-4) in a repeat of last year’s final. The 20-year-old is aiming to become the first player in history to win three straight titles at the ATP Masters 1000 event. “Honestly this match reminds me of last year’s match,” Alcaraz said. “It was pretty difficult from the first point until the last one. It was a great fight and it was difficult. It was difficult for me to deal with my emotions, to handle certain moments, difficult moments in the match. “Serving for the match, it was really difficult for me after that 40-0 up, but really happy that at the end it didn’t affect me with my game, with my mentality. I kept fighting. That’s all that matters and I’m really happy to get the win at the end.” “What a great battle,” Andy Murray’s former coach Miles Maclagan said on Sky Sports Tennis. “The style of game they play and the contest – nothing but respect for Jan-Lennard Struff. “For all that effort there’s no reward in the end but perhaps he’ll take a lot of heart in the way he’s played, the way he’s pushed Alcaraz, the way he’s continued to show resilience and character when I’m sure most would have been writing Alcaraz’s name into the next round. “He kept coming and kept coming and never got down on himself. That is one of his big attributes. This guy’s bag of tricks is a large one. “The power he brings, the athleticism, the punch as well.”— Supersport.   "
